1401	Ay, that incestuous, that adulterate beast, With witchcraft of his wit, with traitorous gifts- O wicked wit and gifts, that have the power So to seduce!- won to his shameful lust The will of my most seeming-virtuous queen. O Hamlet, what a falling-off was there, From me, whose love was of that dignity That it went hand in hand even with the vow I made to her in marriage, and to decline Upon a wretch whose natural gifts were poor   To those of mine! But virtue, as it never will be mov'd, Though lewdness court it in a shape of heaven, So lust, though to a radiant angel link'd, Will sate itself in a celestial bed And prey on garbage. But soft! methinks I scent the morning air. Brief let me be. Sleeping within my orchard, My custom always of the afternoon, Upon my secure hour thy uncle stole, With juice of cursed hebona in a vial, And in the porches of my ears did pour The leperous distilment; whose effect Holds such an enmity with blood of man That swift as quicksilverr it courses through The natural gates and alleys of the body, And with a sudden vigour it doth posset And curd, like eager droppings into milk, The thin and wholesome blood. So did it mine; And a most instant tetter bark'd about,   Most lazar-like, with vile and loathsome crust All my smooth body. Thus was I, sleeping, by a brother's hand Of life, of crown, of queen, at once dispatch'd; Cut off even in the blossoms of my sin, Unhous'led, disappointed, unanel'd, No reckoning made, but sent to my account With all my imperfections on my head. If thou hast nature in thee, bear it not. Let not the royal bed of Denmark be A couch for luxury and damned incest. But, howsoever thou pursuest this act, Taint not thy mind, nor let thy soul contrive Against thy mother aught. Leave her to heaven, And to those thorns that in her bosom lodge To prick and sting her. Fare thee well at once. The glowworm shows the matin to be near And gins to pale his uneffectual fire. Adieu, adieu, adieu! Remember me.	嗯，那个乱伦的奸淫的畜生，他有的是过人的诡诈，天赋的奸恶，凭着他的阴险的手段，诱惑了我的外表上似乎非常贞淑的王后，满足他的无耻的兽欲。啊，哈姆雷特，那是一个多么相去悬殊的差异！我的爱情是那样纯洁真诚，始终信守着我在结婚的时候对她所作的盟誓；她却会对一个天赋的才德远不如我的恶人降心相从！可是正像一个贞洁的女子，虽然淫欲罩上神圣的外表，也不能把她煽动一样，一个淫妇虽然和光明的天使为偶，也会有一天厌倦于天上的唱随之乐，而宁愿搂抱人间的朽骨。可是且慢！我仿佛嗅到了清晨的空气，让我把话说得简短一些，当我按照每天午后的惯例，在花园里睡觉的时候，你的叔父趁我不备，悄悄溜了进来，拿着一个盛着毒草汁的小瓶，把一种使人麻痹的药水注入我的耳腔之内，那药性发作起来，会像水银一样很快地流过全身的大小血管，像酸液滴进牛乳般地把淡薄而健全的血液凝结起来；它一进入我的身体里，我全身光滑的皮肤上便立刻长出无数疱疹，像害着癞病似的满布着可憎的鳞片。这样，我在睡梦之中，被一个兄弟同时夺去了我的生命、我的王冠和我的王后；甚至不给我一个忏罪的机会，使我在没有领到圣餐也没有受过临终涂膏礼时，就一无准备地负着我的全部罪恶去对簿阴曹。可怕啊，可怕！要是你有天性之情，不要默尔而息，不要让丹麦的御寝变成了藏奸养逆的卧榻；可是无论你怎样进行复仇，你的行事必须光明磊落，更不可对你的母亲有什么不利的图谋，她自会受到上天的裁判，和她自己内心中的荆棘的刺戳。现在我必须去了！萤火的微光已经开始暗淡下去，清晨快要到来了；再会，再会！哈姆雷特，记着我。[下]	ZSH
265	And therefore as a stranger give it welcome. There are more things in heaven and earth, Horatio, Than are dreamt of in your philosophy. But come! Here, as before, never, so help you mercy, How strange or odd soe'er I bear myself (As I perchance hereafter shall think meet To put an antic disposition on),   That you, at such times seeing me, never shall, With arms encumb'red thus, or this head-shake, Or by pronouncing of some doubtful phrase, As 'Well, well, we know,' or 'We could, an if we would,' Or 'If we list to speak,' or 'There be, an if they might,' Or such ambiguous giving out, to note That you know aught of me- this is not to do, So grace and mercy at your most need help you, Swear.	那就当稀客来招待，别大惊小怪。你知道夭地间有许多事情，霍拉旭，决不是你们的哲学所梦想得到的。可是来吧！天保佑你们，在这里再发誓一次：不管我举动怎样的离奇古怪，（因为我以后也许要认为应该装出一副疯疯癫癫的样子，）你们看见我这样，千万不要这样子手一叉，或者是这样子头一摇，或者说一句半句的怪言怪语，“嗯，嗯，谁不知道啊！”或者说“愿意说就能说”，或者说“可以说就有人”，说诸如此类闪烁其词的话语，表示你们知道我有什么隐衷：这绝对避免，愿你们沐天恩天惠，发誓吧！	BZL
187	It waves you to a more removed ground. But do not go with it!	轻轻的招呼你跟它上僻远的地点。可是不要跟它去！	BZL
89	Enter Horatio, Marcellus, and Bernardo.	霍拉旭、玛塞勒斯及贝纳陀上。	BZL
1228	Tis here!	它在这儿！	ZSH
524	It shall do well. But yet do I believe The origin and commencement of his grief Sprung from neglected love.- How now, Ophelia? You need not tell us what Lord Hamlet said. We heard it all.- My lord, do as you please; But if you hold it fit, after the play Let his queen mother all alone entreat him   To show his grief. Let her be round with him; And I'll be plac'd so please you, in the ear Of all their conference. If she find him not, To England send him; or confine him where Your wisdom best shall think.	那当然很好。可是我还是相信他这种苦恼的根源，推究起来，到底还是失恋。——怎么样，莪菲丽亚？你不用告诉我们殿下怎么说；我们全听见了。——陛下就那么办吧。 陛下如认为妥当，看戏以后，却不妨让他的母后单独叫他去倾吐心事。请母亲干脆问问他；我愿得陛下许可，躲在一边，听他们密谈。再要是探不出真情，就派他去英国；或者凭陛下的高见，关他在哪一个合适的地方。	BZL
321	Thou still hast been the father of good news.	你简直是一个喜神，总带来好消息。	BZL
1033	O Jephthah, judge of Israel, what a treasure hadst thou!	啊，耶弗他，以色列的士师，你有多么好一件宝贝哟！	SDY
160	What is't, Ophelia, he hath said to you?	莪菲丽亚，他对你说了一些什么话？	BZL
1438	Never to speak of this that you have seen. Swear by my sword.	永不向人提起你们所看见的这一切。把手按在我的剑上宣誓。	ZSH
734	Think it no more. For nature crescent does not grow alone In thews and bulk; but as this temple waxes, The inward service of the mind and soul Grows wide withal. Perhaps he loves you now,   And now no soil nor cautel doth besmirch The virtue of his will; but you must fear, His greatness weigh'd, his will is not his own; For he himself is subject to his birth. He may not, as unvalued persons do, Carve for himself, for on his choice depends The safety and health of this whole state, And therefore must his choice be circumscrib'd Unto the voice and yielding of that body Whereof he is the head. Then if he says he loves you, It fits your wisdom so far to believe it As he in his particular act and place May give his saying deed; which is no further Than the main voice of Denmark goes withal. Then weigh what loss your honour may sustain If with too credent ear you list his songs, Or lose your heart, or your chaste treasure open To his unmast'red importunity. Fear it, Ophelia, fear it, my dear sister, And keep you in the rear of your affection,   Out of the shot and danger of desire. The chariest maid is prodigal enough If she unmask her beauty to the moon. Virtue itself scopes not calumnious strokes. The canker galls the infants of the spring Too oft before their buttons be disclos'd, And in the morn and liquid dew of youth Contagious blastments are most imminent. Be wary then; best safety lies in fear. Youth to itself rebels, though none else near.	正是的；因为人身体成长，不光是筋肉和躯干生发；而当这神殿扩张时，心志和神魂所祈求的内心供奉，也跟着增长。他现在也许爱你，现在还没有肮脏和欺骗玷污他清纯的意向：可是，你得要戒惧，考虑到地位，他不能自己做主；因为他要受他自己身份的限制：他不能像无足轻重的人那样，自己定去取，为的是他选得恰当与否决定着全国的安危和兴废；他身居邦国之首，他妃子的征选自应先得到邦国的赞成和听从，经受到约束。那么，他若说他爱你，你该使用聪明去那般听信他，要他由地位规定他采取的行动能履行他所说的话；而这可不出丹麦宗邦整个都赞同的限度外。然后要衡量你那片贞洁将遭受什么样损失，你若太信他的歌声，或是把真心丢给他，漫无羁勒的强求和硬要会打开你童贞的宝藏。要戒惧，莪斐丽亚，要戒惧，亲妹子，你要待在你真正的意向后边，在他情欲的射程与危险之外。那翼翼小心的姑娘已经够放浪，要是她面对着月亮把芳容暴露；玉洁冰清还难逃诽谤的打击；往往在嫩蕊含苞未放的时节，毛虫就已把阳春的娇儿咬伤，当青春对旭照，在朝露泫泫之际，恶毒的风吹雨打最容易摧折它。所以要小心；最安全莫过于戒惧：没有人在旁，青春尚且会自戕。	SDY
94	Sir, my good friend- I'll change that name with you. And what make you from Wittenberg, Horatio? Marcellus?	“好友”——我们换上这一个称呼吧。你可为什么离开了威登堡，霍拉旭？——玛塞勒斯？	BZL
891	No, my good lord; but, as you did command, I did repel his letters and denied His access to me.	没有，好爸爸，但正如您所关照的，我确曾退回他送来的柬帖，拒绝他前来接近。	SDY
1318	Scene III. Elsinore. A room in the house of Polonius.	第三场　波洛尼厄斯家中的一室	ZSH
825	There needs no ghost, my lord, come from the grave To tell us this.	用不到有鬼魂，殿下，从坟墓里来告我们这个。	SDY
77	Take thy fair hour, Laertes. Time be thine, And thy best graces spend it at thy will! But now, my cousin Hamlet, and my son- [aside] A little more than kin, and less than kind!	善用好时光，莱阿替斯。时间都归你，愿发挥你的美德去充分消受！得，哈姆雷特，我的侄儿，我的儿——哈〔旁白〕亲上加亲，越亲越不相亲！	BZL
1431	 Nor I, my lord- in faith.	凭着良心起誓，殿下，我也决不告诉别人。	ZSH
276	Marry, well said, very well said. Look you, sir, Enquire me first what Danskers are in Paris; And how, and who, what means, and where they keep, What company, at what expense; and finding By this encompassment and drift of question That they do know my son, come you more nearer Than your particular demands will touch it. Take you, as 'twere, some distant knowledge of him; As thus, 'I know his father and his friends, And in part him.' Do you mark this, Reynaldo?	嗯，说得好，说得很好。你听好，先问问巴黎有些什么丹麦人，叫什么，干什么，有什么，住什么地方，交什么朋友，有什么开销，这样子转弯抹角，旁敲侧击，看出了他们确实是认识我的儿子的，你不妨比问长问短更逼进一步；装得象跟他有几分泛泛的相识，譬如说，“我认识他的父亲和朋友，也有点认识他本人。”懂不懂，雷纳尔陀？	BZL
1364	No, by no means!	千万不要跟它去。	ZSH
359	Honest, my lord?	老实，殿下？	BZL
577	Ay, or any show that you'll show him. Be not you asham'd to show, he'll not shame to tell you what it means.	嗯，你给他搬得出什么，他就说得出什么。只要你好意思做出来，他就不会不好意思告诉你那是什么意思。	BZL
872	At 'closes in the consequence,' at 'friend or so,' and   gentleman.'	说到“接上你的话这么说”，说到“朋友或者士子”。	SDY
711	Pale or red?	苍白还是通红？	SDY
634	Thus twice before, and jump at this dead hour, With martial stalk hath he gone by our watch.	这样已两次，正在这死寂的深夜，跨威武的阔步他走过我的岗哨。	SDY
1762	Ay, my lord.	嗯，殿下。	ZSH
138	I will watch to-night. Perchance 'twill walk again.	我今晚去守夜；也许它还会出现的。	BZL
809	Ay, that incestuous, that adulterate beast, With witchcraft of his wit, with traitorous gifts- O wicked wit and gifts, that have the power So to seduce!- won to his shameful lust The will of my most seeming-virtuous queen. O Hamlet, what a falling-off was there, From me, whose love was of that dignity That it went hand in hand even with the vow I made to her in marriage, and to decline Upon a wretch whose natural gifts were poor   To those of mine! But virtue, as it never will be mov'd, Though lewdness court it in a shape of heaven, So lust, though to a radiant angel link'd, Will sate itself in a celestial bed And prey on garbage. But soft! methinks I scent the morning air. Brief let me be. Sleeping within my orchard, My custom always of the afternoon, Upon my secure hour thy uncle stole, With juice of cursed hebona in a vial, And in the porches of my ears did pour The leperous distilment; whose effect Holds such an enmity with blood of man That swift as quicksilverr it courses through The natural gates and alleys of the body, And with a sudden vigour it doth posset And curd, like eager droppings into milk, The thin and wholesome blood. So did it mine; And a most instant tetter bark'd about,   Most lazar-like, with vile and loathsome crust All my smooth body. Thus was I, sleeping, by a brother's hand Of life, of crown, of queen, at once dispatch'd; Cut off even in the blossoms of my sin, Unhous'led, disappointed, unanel'd, No reckoning made, but sent to my account With all my imperfections on my head.	正是的，那个通奸乱伦的禽兽就仗那诡诈的迷功，叛逆的本领——啊，邪恶的聪明和才智，这么样会奸骗！——把我这貌似贞洁的王后，诱得满足了他那无耻的淫欲：啊，哈姆雷特，多自甘的下贱哟！我对她的爱是那么精醇可贵，那和我跟她义结百年姻好时所起的信誓完全相符契，而她竟会委身于这样个伧夫，他对我有什么才智来相比！但正如美德，它永远也不会动心，即令浪荡装扮成天仙来求爱，淫欲，尽管跟光艳的天使结了婚，还会在极乐的天床上感到餍足，而要去贪吃臭烂。且住！我好似闻到了早晨的清气；让我简单说。我在御园里偃息，那是我每天经常的习惯要歇晌，你那叔父偷偷地趁着我不备窜进来，手持一瓶恶毒的紫杉汁，把那引发起全身恶癞的毒精灌进了我的耳孔去；那药性一发就跟人周身的血液水火不相容，只顷刻之间，快得和水银相似，它通行无阻，穿门过路处处到，而且它发作快而猛，像醋酸滴进牛奶，把我的稀薄而健全的血液凝敛冻结了起来：我的血便这样；而且顿时立刻有疹疱散布开，像是大麻风，可恨的呕人的恶癞结满我光滑的全身。便这样，我在睡梦中被一个兄弟一下子把生命、王冠、王后都夺去：就在罪孽深重里一命抛黄泉，来不及接受圣餐，作忏悔，涂油膏，不曾能结算，还戴着满头罪孽，就给赶送到上帝跟前去清账。	SDY
907	Have I, my lord? Assure you, my good liege, I hold my duty as I hold my soul, Both to my God and to my gracious king; And I do think- or else this brain of mine Hunts not the trail of policy so sure As it hath us'd to do- that I have found   The very cause of Hamlet's lunacy.	我是吗，吾主？亲爱的主公，您可以相信，臣下对上帝，对吾主王位，重视我的责任跟重视灵魂一样：而且我认为，除非这区区头脑追随王政的弘猷已不及往常那样灵敏，我如今已经发现了哈姆雷特发疯的真正的因由。	SDY
1352	I think it lacks of twelve.	我想还不到十二点。	ZSH
375	Fare you well, my lord.	再见，殿下。	BZL
448	What treasure had he, my lord?	他有什么宝贝呀，殿下？	BZL
127	Pale or red?	脸色是苍白还是通红？	BZL
1539	We will try it.	我们要试一试。	ZSH
918	This business is well ended. My liege, and madam, to expostulate What majesty should be, what duty is, Why day is day, night is night, and time is time. Were nothing but to waste night, day, and time. Therefore, since brevity is the soul of wit, And tediousness the limbs and outward flourishes, I will be brief. Your noble son is mad. Mad call I it; for, to define true madness, What is't but to be nothing else but mad? But let that go.	这件事结束得很好。我的主公和娘娘，去详细讨论陛下该怎样尊严，我如何尽责，为什么日是日，夜是夜，时间是时间，只是去糟掉黑夜，白日，和时间。因此上，既然简洁是智能的灵魂，噜苏是愚蠢的枝叶，虚夸的外饰，我力求简洁。你们的贵殿下疯了：疯了，我说他；因为，要阐明真疯，除掉发疯外别无它，还能有什么？算了吧。	SDY
511	Ay, truly; for the power of beauty will sooner transform honesty from what it is to a bawd than the force of honesty can translate beauty into his likeness. This was sometime a paradox, but now the time gives it proof. I did love you once.	嗯，真的；因为美丽的力量倒容易把贞洁点化成淫荡，贞洁的力量可难于把美丽改成了象它自己的样子。这本来是一种怪论，可是现在时势却让它得到了证明。我从前的确爱过你。	BZL
1289	As I do live, my honour'd lord, 'tis true;   And we did think it writ down in our duty To let you know of it.	凭着我的生命起誓，殿下，这是真的，我们认为按照我们的责任，应该让您知道这件事。	ZSH
1370	You shall not go, my lord.	您不能去，殿下。	ZSH
567	Ay, my lord.	嗯，殿下。	BZL
431	Ay, that they do, my lord- Hercules and his load too.	正是呢，殿下——连赫勾列和他背的地球都始席卷了去了。	BZL
1716	Get thee to a nunnery! Why wouldst thou be a breeder of sinners? I am myself indifferent honest, but yet I could accuse me of such things that it were better my mother had not borne me.   I am very proud, revengeful, ambitious; with more offences at my beck than I have thoughts to put them in, imagination to give them shape, or time to act them in. What should such fellows as I do, crawling between earth and heaven? We are arrant knaves all; believe none of us. Go thy ways to a nunnery. Where's your father?	进尼姑庵去吧；为什么你要生一群罪人出来呢？我自己还不算是一个顶坏的人；可是我可以指出我的许多过失，一个人有了那些过失，他的母亲还是不要生下他来的好。我很骄傲，有仇必报，富于野心，还有那么多的罪恶，连我的思想里也容纳不下，我的想象也不能给它们形象，甚至于我没有充分的时间可以把它们实行出来，像我这样的家伙，匍匐于天地之间，有什么用处呢？我们都是些十足的坏人；一个也不要相信我们。进尼姑庵去吧。你的父亲呢？	ZSH
286	Marry, sir, here's my drift, And I believe it is a fetch of warrant. You laying these slight sullies on my son As 'twere a thing a little soil'd i' th' working, Mark you, Your party in converse, him you would sound, Having ever seen in the prenominate crimes The youth you breathe of guilty, be assur'd He closes with you in this consequence: 'Good sir,' or so, or 'friend,' or 'gentleman'- According to the phrase or the addition Of man and country-	其中自有妙处，我相信这是个管保成功的策略：你就当捏东西难免留下的手指印，给我的儿子加上这些小污点，听好，跟你谈话的、你要试探的对方，如果见过你所说的这位年轻人真犯了上面所说的那些过失，靠得住就会同意你，会如此这般说：“好先生”，或者说“朋友”，或者说“仁兄”，全看人不同，地不同，风习不同，称呼也就不一样。	BZL
1198	Well, sit we down, And let us hear Bernardo speak of this.	好，我们坐下来，听听勃那多怎么说。	ZSH
332	This business is well ended. My liege, and madam, to expostulate What majesty should be, what duty is, Why day is day, night is night, and time is time. Were nothing but to waste night, day, and time. Therefore, since brevity is the soul of wit, And tediousness the limbs and outward flourishes, I will be brief. Your noble son is mad. Mad call I it; for, to define true madness, What is't but to be nothing else but mad? But let that go.	好了，结果圆满。 王上，王后娘娘，我要是谈论什么是君上的尊严、臣下的本分，为什么日是日、夜是夜、时间是时间，那无非是浪费日夜，是糟蹋时间。所以明知道简洁是智慧的灵魂，冗长是乏味的枝叶、肤浅的花饰，我要说得简短，殿下是疯了：我管叫他疯了：因为要说明真疯，那就是发疯，还有什么可说？算了吧。	BZL
370	[aside] Though this be madness, yet there is a method in't.- Will You walk out of the air, my lord?	[旁白]这虽然是疯话，却也有条理。——殿下想走到不通风的地方去吗？	BZL
1570	As the indifferent children of the earth.	不过像一般庸庸碌碌之辈，在这世上虚度时光而已。	ZSH
596	Enter Horatio and Marcellus.	[霍瑞旭与马帅勒史上。	SDY
1531	Hath there been such a time- I would fain know that- That I have Positively said ''Tis so,' When it prov'd otherwise.?	我倒很想知道知道，哪一次我曾经肯定地说过了“这件事情是这样的”，而结果却并不这样？	ZSH
1553	Let her not walk i' th' sun. Conception is a blessing, but not as your daughter may conceive. Friend, look to't.	不要让她在太阳光底下行走；怀孕是一种幸福，可是你的女儿要是怀了孕，那可糟了。朋友，留心哪。	ZSH
42	It is offended.	触犯了它了。	BZL
235	O, wonderful!	噢，怪极了！	BZL
616	Last night of all, When yond same star that's westward from the pole Had made his course t' illume that part of heaven Where now it burns, Marcellus and myself, The bell then beating one-	就在昨天夜里，那时节北极星西首的那颗星儿正好行过去照耀西天的那一方，它如今正在那边亮，马帅勒史和我，刚正敲一点钟——	SDY
1013	Faith, there has been much to do on both sides; and the nation holds it no sin to tarre them to controversy. There was, for a while, no money bid for argument unless the poet and the player went to cuffs in the question.	当真，双方争执个不休；人们又不怕罪过，煽动他们去吵架：弄到有一晌没有人出钱收买演戏的脚本，除非诗人和伶人叫台词里充满着吵闹。	SDY
540	O, my dear lord!	噢，殿下。	BZL
1346	I shall obey, my lord. Exeunt.	我一定听从您的话，父亲。[同下]	ZSH
737	O, fear me not! I stay too long. But here my father comes. A double blessing is a double grace; Occasion smiles upon a second leave.	莫替我担忧。我耽搁得太久：父亲可又来了。双重的祝福自会有再度的天恩；凑巧的机缘笑对这第二回告别。	SDY
1077	We shall, my lord.	遵命，主上。	SDY
181	Is it a custom?	这可是向来的风俗？	BZL
894	That hath made him mad. I am sorry that with better heed and judgment I had not quoted him. I fear'd he did but trifle And meant to wrack thee; but beshrew my jealousy! By heaven, it is as proper to our age To cast beyond ourselves in our opinions As it is common for the younger sort To lack discretion. Come, go we to the King. This must be known; which, being kept close, might move More grief to hide than hate to utter love. Come.	那就害得他发了疯。我很抱歉，没有用较好的注意和判断去将他看待：我怕他只想玩弄你，把你毁；我这多疑真该死！苍天在上，在我们这样的年龄最容易随便把事情估计错误，正如同年轻的一辈太欠少思虑，同样地普通。来吧，我们见王上去：这事一定得报知；若秘不声张，会引起比讲后的恼恨更多悲伤。来。[同下。	SDY
1265	I am very glad to see you.- [To Bernardo] 	我很高兴看见你。[向勃那多]	ZSH
