1516	Madam, I swear I use no art at all. That he is mad, 'tis true: 'tis true 'tis pity; And pity 'tis 'tis true. A foolish figure! But farewell it, for I will use no art.   Mad let us grant him then. And now remains That we find out the cause of this effect- Or rather say, the cause of this defect, For this effect defective comes by cause. Thus it remains, and the remainder thus. Perpend. I have a daughter (have while she is mine), Who in her duty and obedience, mark, Hath given me this. Now gather, and surmise.the letter. 'To the celestial, and my soul's idol, the most beautified Ophelia,'- That's an ill phrase, a vile phrase; 'beautified' is a vile phrase. But you shall hear. Thus:'In her excellent white bosom, these, &c.'	娘娘，我发誓我一点不弄玄虚。他疯了，这是真的；唯其是真的，所以才可叹，它的可叹也是真的——蠢话少说，因为我不愿弄玄虚。好，让我们同意他已经疯了；现在我们就应该求出这一个结果的原因，或者不如说，这一种病态的原因，因为这个病态的结果不是无因而致的，这就是我们现在要做的一步工作。我们来想一想吧。我有一个女儿——当她还不过是我的女儿的时候，她是属于我的——难得她一片孝心，把这封信给了我，现在请猜一猜这里面说些什么话。“给那天仙化人的，我的灵魂的偶像，最美丽的奥菲利娅——”这是一个粗俗的句子；可是你们听下去吧，“让这几行诗句留下在她的皎洁的胸中——”	ZSH
1217	Thus twice before, and jump at this dead hour, With martial stalk hath he gone by our watch.	前面两次它也是这样不先不后地在这个寂静的时辰，用军人的步态走过我们的眼前。	ZSH
516	At home, my lord.	在家里，殿下。	BZL
792	Whither wilt thou lead me? Speak! I'll go no further.	你要领我到哪里去？说；我不走了。	SDY
261	Hic et ubique? Then we'll shift our ground. Come hither, gentlemen, And lay your hands again upon my sword. Never to speak of this that you have heard: Swear by my sword.	“从一处到百处”？我们换一个地方吧。这儿来，你们二位，你们再一次把手按着我的剑：永远不说出你们听见的这一切，凭我的剑来发誓。	BZL
674	Enter Horatio, Marcellus, and Bernardo.	[霍瑞旭，马帅勒史与剖那陀上。	SDY
469	God's bodykins, man, much better! Use every man after his desert, and who should scape whipping? Use them after your own   honour and dignity. The less they deserve, the more merit is in your bounty. Take them in.	哎呀，老兄，要额外优待才是！要是按各人的功德对待每一个人，那么谁又能逃得了一顿鞭子呢？按你自己的体面和排场来对待他们：他们愈是不配，你的功德愈是无量。带他们进去。	BZL
930	Hath there been such a time- I would fain know that- That I have Positively said ''Tis so,' When it prov'd otherwise.?	可有过这样一次吗，我乐于知道，我已经断然说过了“事情是这样”，而显得并不如此？	SDY
1653	Run barefoot up and down, threat'ning the flames	满面流泪，在火焰中赤脚奔走，一块布覆在失去宝冕的头上。	ZSH
1391	So art thou to revenge, when thou shalt hear.	你听了以后，必须替我报仇。	ZSH
1494	Good gentlemen, he hath much talk'd of you, And sure I am two men there are not living To whom he more adheres. If it will please you To show us so much gentry and good will As to expend your time with us awhile For the supply and profit of our hope, Your visitation shall receive such thanks As fits a king's remembrance.	他常常讲起你们两位，我相信世上没有哪两个人比你们更为他所亲信了。你们要是不嫌怠慢，答应在我们这儿小作逗留，帮助我们实现我们的希望，那么你们的盛情雅意，一定会受到丹麦王室隆重的礼谢的。	ZSH
1566	[to Polonius] God save you, sir!	上帝保佑您，大人！[波洛尼厄斯下]	ZSH
1447	[beneath]	[在下]	ZSH
1194	I have seen nothing.	我还没有瞧见什么。	ZSH
33	When yond same star that's westward from the pole Had made his course t' illume that part of heaven Where now it burns, Marcellus and myself, The bell then beating one- Enter Ghost.	当时，就在北极星西边的那颗星刚好转过去照耀西天的一角，恰好就是它现在照亮的那边，玛塞勒斯和我冈惭见打了一点钟——鬼魂上。	BZL
568	O God, your only jig-maker! What should a man do but be merry? For look you how cheerfully my mother looks, and my father died within 's two hours.	天啊，我是你的独一无二的说笑专家。一个人除了说说笑笑，该做什么呢？你看我的母亲就多么高高兴兴，而我的父亲还只死了两个钟头哩。	BZL
54	That can I. At least, the whisper goes so. Our last king, Whose image even but now appear'd to us, Was, as you know, by Fortinbras of Norway, Thereto prick'd on by a most emulate pride, Dar'd to the combat; in which our valiant Hamlet (For so this side of our known world esteem'd him) Did slay this Fortinbras; who, by a seal'd compact, Well ratified by law and heraldry, Did forfeit, with his life, all those his lands Which he stood seiz'd of, to the conqueror; Against the which a moiety competent Was gaged by our king; which had return'd To the inheritance of Fortinbras, Had he been vanquisher, as, by the same comart And carriage of the article design'd, His fell to Hamlet. Now, sir, young Fortinbras, Of unimproved mettle hot and full,   Hath in the skirts of Norway, here and there, Shark'd up a list of lawless resolutes, For food and diet, to some enterprise That hath a stomach in't; which is no other, As it doth well appear unto our state, 	我可以；至少传说是如此，先王陛下，刚才还仿佛露过了一下子脸呢，当年碰上了挪威王福丁布拉斯骄矜好胜，一定要前来挑战，你们都知道的；我们英武的哈姆雷特是举世闻名的，就在一场决斗中杀死了福丁布拉斯，事先有协定，双方批准，还郑重宣布过公约，败者结果是不但断送了性命而且把所有的土地送给了胜者。先玉当然也提出过相当的土地押了注：要是福丁布拉斯得胜呢，这部分土地也就归他所有，正如协定中同一款明文规定的、他要是失败，就得把所有的土地转送给哈姆雷特。如今小福丁布拉斯狙气方刚，还不知天高地厚，已经在挪威边境，东一处西一处，招聚了一批没有土地的亡命徒，管他们吃喝，要他们大举出动尝一尝冒险的滋味；用意所在，我们的当局看得清清楚楚，无非是要用武力和强迫手段。	BZL
390	Then is doomsday near! But your news is not true. Let me question more in particular. What have you, my good friends, deserved at the hands of Fortune that she sends you to prison hither?	那么世界的末日快到了。可惜你们的消息并不真实。让我再仔细问问看：好朋友，你们在命运女神手下犯了什么案子，才叫她把你们打发到这儿监狱里来了？	BZL
1552	I have, my lord.	我有，殿下。	ZSH
748	Affection? Pooh! You speak like a green girl, Unsifted in such perilous circumstance. Do you believe his tenders, as you call them?	爱情！呸！你说话真像个傻丫头，全没有经历过这样危险的情势。你相信他的献出吗，如你所说的？	SDY
708	O, yes, my lord! He wore his beaver up.	见到的，殿下；他把护面甲推到了上边去。	SDY
848	And therefore as a stranger give it welcome. There are more things in heaven and earth, Horatio, Than are dreamt of in your philosophy. But come! Here, as before, never, so help you mercy, How strange or odd soe'er I bear myself (As I perchance hereafter shall think meet To put an antic disposition on),   That you, at such times seeing me, never shall, With arms encumb'red thus, or this head-shake, Or by pronouncing of some doubtful phrase, As 'Well, well, we know,' or 'We could, an if we would,' Or 'If we list to speak,' or 'There be, an if they might,' Or such ambiguous giving out, to note That you know aught of me- this is not to do, So grace and mercy at your most need help you, Swear.	所以就把它当生客来对待，莫怪。须知天地间有些事情，霍瑞旭，你们那哲学做梦也没有梦到。可是，来吧；天保佑你们，这里，刚才那样发个誓，不管我举动怎样离奇，因为我从今往后也许会觉得该装出一副古怪的言谈行止，你们那时节看到我这样，决不要把臂肘这般交叉起，或这般摇头，或者说些引人起疑心的语句如“很好，我们知道”，或“要说可以说”，或“要是我们高兴说”，或“能说自有人”，或这类模糊影响的话语，表示你们知道我有什么隐衷：这种种都决不能做，愿你们获天赐慈恩，就发誓。	SDY
853	Enter Polonius and Reynaldo.	朴罗纽司与雷那尔铎上。	SDY
635	In what particular thought to work I know not; But, in the gross and scope of my opinion, This bodes some strange eruption to our state.	我可不知道该作怎样的想法；不过就我所看到的大体来说，这预兆对于邦国有惊人的动荡。	SDY
1511	Welcome, my good friends. Say, Voltemand, what from our brother Norway?	欢迎，我的好朋友们！伏提曼德，我们的挪威王兄怎么说？	ZSH
183	Look, my lord, it comes!	殿下看，它来了！	BZL
676	Hail to your lordship!	祝殿下康泰！	SDY
1673	We'll ha't to-morrow night. You could, for a need, study a speech of some dozen or sixteen lines which I would set down and insert in't, could you not?	那么我们明天晚上就把它上演。也许我为了必要的理由，要另外写下约莫十几行句子的一段剧词插进去，你能够把它预先背熟吗？	ZSH
1736	Bid the players make haste, [Exit Polonius.] Will you two help to hasten them?	叫那些戏子们赶紧点儿。[波洛尼厄斯下]你们两人也去帮着催催他们。	ZSH
417	To think, my lord, if you delight not in man, what lenten entertainment the players shall receive from you. We coted them on the way, and hither are they coming to offer you service.	我只是想，既然殿下不欢喜人，那一批戏子到殿下跟前来怕只有自讨没趣了。我们在路上赶过了他们，他们正要到这儿来向殿下献技呢。	BZL
643	Do, if it will not stand.	斫它，它若不站住。	SDY
806	Haste me to know't, that I, with wings as swift As meditation or the thoughts of love, May sweep to my revenge.	快给我知道，我好插起了翅膀，迅捷如思想，疾速如恋爱的情思，风驰着去还报。	SDY
1314	If it assume my noble father's person, I'll speak to it, though hell itself should gape And bid me hold my peace. I pray you all, If you have hitherto conceal'd this sight, Let it be tenable in your silence still; And whatsoever else shall hap to-night, Give it an understanding but no tongue. I will requite your loves. So, fare you well. Upon the platform, 'twixt eleven and twelve, I'll visit you.	要是它借着我的父王的形貌出现，即使地狱张开嘴来，叫我不要作声，我也一定要对它说话。要是你们到现在还没有把你们所看见的告诉别人，那么我就要请求你们大家继续保持沉默；无论今夜发生什么事情，都请放在心里，不要在口舌之间泄露出去。我一定会报答你们的忠诚。好，再会；今晚十一点钟到十二点钟之间，我要到露台上来看你们。	ZSH
1268	I would not hear your enemy say so, Nor shall you do my ear that violence To make it truster of your own report Against yourself. I know you are no truant. But what is your affair in Elsinore? We'll teach you to drink deep ere you depart.	我不愿听见你的仇敌说这样的话，你也不能用这样的话刺痛我的耳朵，使它相信你对自己所作的诽谤；我知道你不是一个偷闲躲懒的人。可是你到艾尔西诺来有什么事？趁你未去之前，我们要陪你痛饮几杯哩。	ZSH
1461	Ay, or drinking, fencing, swearing, quarrelling, Drabbing. You may go so far.	对了，或是喝酒、斗剑、赌咒、吵嘴、嫖妓之类，你都可以说。	ZSH
1113	 Speak the speech, I pray you, as I pronounc'd it to you, trippingly on the tongue. But if you mouth it, as many of our players do, I had as live the town crier spoke my lines. Nor do not saw the air too much with your hand, thus, but use all gently; for in the very torrent, tempest, and (as I may say) whirlwind of your passion, you must acquire and beget a temperance that may give it smoothness. O, it offends me to the soul to hear a robustious periwig-pated fellow tear a passion to tatters, to very rags, to split the cars of the groundlings, who (for the most part) are capable of nothing but inexplicable dumb shows and noise. I would have such a fellow whipp'd for o'erdoing Termagant. It out-herods Herod. Pray you avoid it.	讲这段台词，我请你要照我刚才念给你听的那样，从舌尖上的溜溜滚出来：可是你若用装腔的大嗓子讲，像你们好些个伶工那样，我宁愿叫宣读告示的公差来讲我的词儿，也莫把手老在空中拉锯，这样；而是要表演得平和温顺；因为在你那热情的激流，风暴，甚至，我可以说，旋风之中，你应当力求做到中和稳静，才能把它温润圆到地表达出来。啊，当我听见那暴烈的戴假发的相好把一段热情的台词扯成了破烂，撕得烂碎纷飞，去震裂站池子的听众的耳朵时，他们大多数只赏识莫名其妙的哑剧和哄闹，那时节才要我的命呢：我真愿叫那样个相好挨上一顿鞭子，他把凶神忒蛮冈演得凶过了头；那比暴君赫勒特还暴：请你莫那样做。	SDY
1487	He took me by the wrist and held me hard; Then goes he to the length of all his arm, And, with his other hand thus o'er his brow, He falls to such perusal of my face As he would draw it. Long stay'd he so. At last, a little shaking of mine arm, And thrice his head thus waving up and down, He rais'd a sigh so piteous and profound As it did seem to shatter all his bulk And end his being. That done, he lets me go, And with his head over his shoulder turn'd He seem'd to find his way without his eyes, For out o' doors he went without their help And to the last bended their light on me.	他握住我的手腕紧紧不放，拉直了手臂向后退立，用他的另一只手这样遮在他的额角上，一眼不眨地瞧着我的脸，好像要把它临摹下来似的。这样经过了好久的时间，然后他轻轻地摇动一下我的手臂，他的头上上下下地点了三次，于是他发出一声非常惨痛而深长的叹息，好像他的整个的胸部都要爆裂，他的生命就在这一声叹息中间完毕似的。然后他放松了我，转过他的身体，他的头还是向后回顾，好像他不用眼睛的帮助也能够找到他的路，因为直到他走出了门外，他的两眼还是注视在我的身上。	ZSH
17	And liegemen to the Dane.	都是丹麦国王的臣民。	BZL
1449	Rest, rest, perturbed spirit! So, gentlemen, With all my love I do commend me to you; And what so poor a man as Hamlet is May do t' express his love and friending to you, God willing, shall not lack. Let us go in together; And still your fingers on your lips, I pray. The time is out of joint. O cursed spite That ever I was born to set it right! Nay, come, let's go together. 	安息吧，安息吧，受难的灵魂！好，朋友们，我以全心的真情，信赖着你们两位；要是在哈姆雷特的微弱的能力以内，能够有可以向你们表示他的友情之处，上帝在上，我一定不会有负你们。让我们一同进去；请你们记着无论在什么时候都要守口如瓶。这是一个颠倒混乱的时代，唉，倒霉的我却要负起重整乾坤的责任！来，我们一块儿去吧。[同下]	ZSH
924	But how hath she Receiv'd his love?	可是她自己怎样对待他的爱？	SDY
1086	I humbly thank you; well, well, well.	多谢您，贵芳仪；很好，很好，很好。	SDY
1656	About her lank and all o'erteemed loins,	裹住她瘦削而多产的腰身；	ZSH
928	Do you think 'tis this?	你以为正是这样吗？	SDY
1611	Do they hold the same estimation they did when I was in the city? Are they so follow'd?	他们的名誉还是跟我在城里那时候一样吗？他们的观众还是那么多吗？	ZSH
784	He waxes desperate with imagination.	他变得不顾一切，乱想些什么。	SDY
444	Buzz, buzz!	呔，呔！	BZL
101	Indeed, my lord, it followed hard upon.	的确，婚礼也就紧接着来了。	BZL
492	We shall, my lord.	是，陛下。	BZL
1658	Who this had seen, with tongue in venom steep'd	不要向残酷的命运申申毒詈？	ZSH
888	What said he?	他说些什么？	SDY
578	You are naught, you are naught! I'll mark the play. Pro. For us, and for our tragedy, Here stooping to your clemency, We beg your hearing patiently.    	殿下真淘气，殿下真淘气！我要看我的戏。伶人[开场白]今晚来献丑，上演悲剧，先向各位来把躬一鞠，	BZL
1594	Beggar that I am, I am even poor in thanks; but I thank you; and sure, dear friends, my thanks are too dear a halfpenny. Were you not sent for? Is it your own inclining? Is it a free visitation? Come, deal justly with me. Come, come! Nay, speak.	像我这样一个叫花子，我的感谢也是不值钱的，可是我谢谢你们；我想，亲爱的朋友们，你们专诚而来，只换到我的一声不值半文钱的感谢，未免太不值得了。不是有人叫你们来的吗？果然是你们自己的意思吗？真的是自动的访问吗？来，不要骗我。来，来，快说。	ZSH
115	My lord, upon the platform where we watch'd.	殿下，就是在我们守夜的平台上。	BZL
672	Flourish. Exeunt all but Hamlet.	[号角齐鸣。除哈姆雷特外俱下。	SDY
787	Something is rotten in the state of Denmark.	丹麦宗邦里什么事出了乱子。	SDY
279	As gaming, my lord.	譬如说赌博，老爷。	BZL
1671	Dost thou hear me, old friend? Can you play 'The Murther of Gonzago'?	听着，老朋友，你会演《贡萨洛之死》吗？	ZSH
710	A countenance more in sorrow than in anger.	那脸容要说发怒，不如说在悲伤。	SDY
1134	What did you enact?	你扮演什么？	SDY
1668	God's bodykins, man, much better! Use every man after his desert, and who should scape whipping? Use them after your own   honour and dignity. The less they deserve, the more merit is in your bounty. Take them in.	哎哟，朋友，还要客气得多哩！要是照每一个应得的名分对待他，那么谁逃得了一顿鞭子？照你自己的名誉地位对待他们；他们越是不配受这样的待遇，越可以显出你的谦虚有礼。领他们进去。	ZSH
316	Thanks, Rosencrantz and gentle Guildenstern.	谢谢，罗森克兰兹，纪尔顿斯丹。	BZL
251	My lord, not I.	殿下，我决不。	BZL
1523	O dear Ophelia, I am ill at these numbers; I have not art to reckon my groans; but that I love thee best, O most best, believe it. Adieu.'Thine evermore, most dear lady, whilst this machine is to him, HAMLET.	亲爱的奥菲利娅啊！我的诗写得太坏。我不会用诗句来抒写我的愁怀；可是相信我，最好的人儿啊！我最爱的是你。再会！最亲爱的小姐，只要我一息尚存，我就永远是你的，哈姆雷特。	ZSH
780	You shall not go, my lord.	您不能前去，殿下。	SDY
26	I have seen nothing.	我没有看见什么。	BZL
213	So art thou to revenge, when thou shalt hear.	你听了以后，也一定得替我报仇。	BZL
179	Indeed? I heard it not. It then draws near the season Wherein the spirit held his wont to walk. A flourish of trumpets, and two pieces go off. What does this mean, my lord?	真的？我没有听见。如此说来，时候快到了，精灵要照例出现了。（内奏喇叭，鸣炮。这是什么意思，殿下？	BZL
542	 Well, my lord. If he steal aught the whilst this play is playing, And scape detecting, I will pay the theft. Sound a flourish. [Enter Trumpets and Kettledrums. Danish march. 	好，殿下。演戏的时候，如果他偷露出什么而没有被抓住，我甘愿负失窃之罪。	BZL
549	What did you enact?	你演过什么角色？	BZL
818	O, wonderful!	啊，好奇怪！	SDY
254	We have sworn, my lord, already.	殿下，我们已经发了誓。	BZL
1454	I will, my lord.	是，老爷。	ZSH
1009	No indeed are they not.	不，当真，不如从前了。	SDY
1547	Then I would you were so honest a man.	那么我但愿你是一个和鱼贩子一样的老实人。	ZSH
1201	Enter Ghost.	鬼魂上。	ZSH
1260	Hail to your lordship!	祝福，殿下！	ZSH
190	Do not, my lord!	不要去，殿下！	BZL
1775	What means this, my lord?	这是什么意思，殿下？	ZSH
1058	We'll ha't to-morrow night. You could, for a need, study a speech of some dozen or sixteen lines which I would set down and insert in't, could you not?	我们明晚上要演它。我有需要写上十二到十六行一段台词插进去，你能背得不能？	SDY
997	[aside to Guildenstern] What say you?	[旁白，向吉尔腾司登]你怎么说？	SDY
1540	But look where sadly the poor wretch comes reading.	可是瞧，这可怜的孩子忧忧愁愁地念着一本书来了。	ZSH
175	It is a nipping and an eager air.	真叫是寒风凛冽，砭人肌骨。	BZL
950	I have, my lord.	我有，殿下。	SDY
683	I would not hear your enemy say so, Nor shall you do my ear that violence To make it truster of your own report Against yourself. I know you are no truant. But what is your affair in Elsinore? We'll teach you to drink deep ere you depart.	我不愿听你的仇家这么说你，也不能让你这般打击我这耳朵，要它相信你对你自己这么样诋毁；我知道你不是懒散的浪子。可是你到埃尔辛诺来做什么？你离开之前我们要教会你酣饮。	SDY
1244	He hath, my lord, wrung from me my slow leave By laboursome petition, and at last Upon his will I seal'd my hard consent. I do beseech you give him leave to go.	陛下，我却不过他几次三番的恳求，已经勉强答应他了；请陛下放他去吧。	ZSH
1018	There are the players.	戏子们来了。	SDY
346	Take this from this, if this be otherwise. [points to his head and shoulder] If circumstances lead me, I will find Where truth is hid, though it were hid indeed Within the centre.	要是我说错了，把这个从这儿拿掉吧！’[自指头肩。只要环境许可，我总会找出来事实的真相，尽管它一直躲到了地中心。哈姆雷特上，手持一书，且读且行，闻声止步，未被觉察。	BZL
1303	Most constantly.	它直盯着我瞧。	ZSH
943	Excellent well. You are a fishmonger.	认识得很：你是个鱼贩子。	SDY
1010	How comes it? Do they grow rusty?	怎么？他们变得荒疏了吗？	SDY
1532	Not that I know.	照我所知道的，那倒没有。	ZSH
221	I find thee apt; And duller shouldst thou be than the fat weed   That rots itself in ease on Lethe wharf, Wouldst thou not stir in this. Now, Hamlet, hear. 'Tis given out that, sleeping in my orchard, A serpent stung me. So the whole ear of Denmark Is by a forged process of my death Rankly abus'd. But know, thou noble youth, The serpent that did sting thy father's life Now wears his crown.	我看出你是积极的；你如果对这件事情不采取行动，就比忘川河岸上懒坏的水草还要迟钝了。得，哈姆雷特，听我说。人家宣布说，我在花园里睡觉，一条蛇把我咬了。这一个虚构的死因，恶毒万分，把丹麦全国的听闻一手遮掩了。可是你，高贵的青年，要知道那一条咬死你父亲的毒蛇现在就戴了王冠。怪不得我先恨啊！	BZL
1334	Farewell.Exit.	再会！[下]	ZSH
211	Pity me not, but lend thy serious hearing To what I shall unfold.	不要可怜我，只要认真听我要说的事情。	BZL
1416	Nor I, my lord.	我也一定不泄露，殿下。	ZSH
910	[Exit Polonius.]	[朴罗纽司下。	SDY
1262	The same, my lord, and your poor servant ever.	我也是这样，殿下；我永远是您的卑微的仆人。	ZSH
1312	I will watch to-night. Perchance 'twill walk again.	我今晚也要守夜去；也许它还会出来。	ZSH
39	It would be spoke to.	他要我们先开口。	BZL
1480	How now, Ophelia? What's the matter?	啊，奥菲利娅！什么事？	ZSH
1195	Horatio says 'tis but our fantasy, And will not let belief take hold of him Touching this dreaded sight, twice seen of us. Therefore I have entreated him along,   With us to watch the minutes of this night, That, if again this apparition come, He may approve our eyes and speak to it.	霍拉旭说那不过是我们的幻象。我告诉他我们已经两次看见过这一个可怕的怪象，他总是不肯相信；所以我请他今晚也来陪我们守一夜，要是这鬼魂再出来，就可以证明我们并没有看错，还可以叫他和它说几句话。	ZSH
15	I think I hear them. Stand, ho! Who is there? Enter Horatio and Marcellus.	好象是他们的声音了。站住！谁？霍拉旭与玛塞勒斯上。	BZL
1538	At such a time I'll loose my daughter to him. Be you and I behind an arras then. Mark the encounter. If he love her not, And he not from his reason fall'n thereon Let me be no assistant for a state,   But keep a farm and carters.	趁他踱来踱去的时候，我就让我的女儿去见他，你我可以躲在帷帐后面注视他们相会的情形；要是他不爱她，他的理智不是因为恋爱而丧失，那么不要叫我襄理国家的政务，让我去做个耕田的农夫吧。	ZSH
